A1: Item Code | B1: count | C1: Fluid oz | D1: solid oz | E1: cost | F1: waste g | G1: brand | H1: type | I1: material | J1: totals | K1: comments
A2: food package | B2: 2 | D2: 12 | G2: Albertsons, western Family | H2: food pazckage | I2: Cardboard | J2: =IF(C2+D2=0,B2,IF(D2="",B2*C2,IF(C2 ="",B2*D2))) -> 24
A3: paper | B3: 17 | D3: 2 | E3: free | H3: junk mail | J3: =IF(C3+D3=0,B3,IF(D3="",B3*C3,IF(C3 ="",B3*D3))) -> 34
A4: air freshner | B4: 1 | G4: wizard | H4: scented oil | I4: plastic, cardboard | J4: =IF(C4+D4=0,B4,IF(D4="",B4*C4,IF(C4 ="",B4*D4))) -> 1
A5: air freshner | B5: 1 | G5: wizard, Refill | H5: scented oil | I5: plastic, cardboard | J5: =IF(C5+D5=0,B5,IF(D5="",B5*C5,IF(C5 ="",B5*D5))) -> 1
A6: food package | B6: 1 | D6: 9 | G6: Morning Star Farms | H6: food Package | I6: cardboard | J6: =IF(C6+D6=0,B6,IF(D6="",B6*C6,IF(C6 ="",B6*D6))) -> 9 | K6: veggie Burger
A7: food package | B7: 1 | D7: 31.4 | G7: kellog | H7: food Package | I7: Cardboard | J7: =IF(C7+D7=0,B7,IF(D7="",B7*C7,IF(C7 ="",B7*D7))) -> 31.4 | K7: cinimon Crunch Crispix
A8: plastic | B8: 1 | G8: Clean ones | J8: =IF(C8+D8=0,B8,IF(D8="",B8*C8,IF(C8 ="",B8*D8))) -> 1 | K8: latex Gloves
A9: food package | B9: 1 | C9: 64 | G9: Foster Farms | H9: food Package | I9: Cardboard | J9: =IF(C9+D9=0,B9,IF(D9="",B9*C9,IF(C9 ="",B9*D9))) -> 64 | K9: milk
A10: food package | B10: 1 | G10: KFC | H10: food Package | I10: Cardboard | J10: =IF(C10+D10=0,B10,IF(D10="",B10*C10,IF(C10 ="",B10*D10))) -> 1 | K10: Biscuits
A11: food package | B11: 1 | D11: 8 | G11: Arm & Hammer | H11: food Package | I11: Cardboard | J11: =IF(C11+D11=0,B11,IF(D11="",B11*C11,IF(C11 ="",B11*D11))) -> 8 | K11: Baking Soda
A12: food package | B12: 1 | D12: 6.9 | G12: chex | H12: food | I12: Cardboard | J12: =IF(C12+D12=0,B12,IF(D12="",B12*C12,IF(C12 ="",B12*D12))) -> 6.9
A13: toy | B13: 1 | G13: Bubbling Gl | H13: toy | I13: Cardboard | J13: =IF(C13+D13=0,B13,IF(D13="",B13*C13,IF(C13 ="",B13*D13))) -> 1
A14: packaging | B14: 1 | G14: Energy Choice | H14: light Bulbs | J14: =IF(C14+D14=0,B14,IF(D14="",B14*C14,IF(C14 ="",B14*D14))) -> 1
A15: packaging | B15: 1 | G15: hefty | H15: garbage bags | J15: =IF(C15+D15=0,B15,IF(D15="",B15*C15,IF(C15 ="",B15*D15))) -> 1
A16: packaging | B16: 1 | G16: Fram | H16: Car Air Filter | J16: =IF(C16+D16=0,B16,IF(D16="",B16*C16,IF(C16 ="",B16*D16))) -> 1
A17: packaging | B17: 1 | G17: fram | H17: oil filter | J17: =IF(C17+D17=0,B17,IF(D17="",B17*C17,IF(C17 ="",B17*D17))) -> 1
A18: packaging | B18: 1 | G18: penzoil | H18: oil filter rench | J18: =IF(C18+D18=0,B18,IF(D18="",B18*C18,IF(C18 ="",B18*D18))) -> 1
A19: PACKAGING | B19: 5 | C19: 32 | G19: CASTROL | H19: MOTEROIL | J19: =IF(C19+D19=0,B19,IF(D19="",B19*C19,IF(C19 ="",B19*D19))) -> 160
A20: food package | B20: 1 | D20: 5 | G20: Nevada High desert | H20: onions | J20: =IF(C20+D20=0,B20,IF(D20="",B20*C20,IF(C20 ="",B20*D20))) -> 5 | K20: lb
A21: food package | B21: 1 | G21: duchess | H21: tea | J21: =IF(C21+D21=0,B21,IF(D21="",B21*C21,IF(C21 ="",B21*D21))) -> 1
A22: lightbulb | B22: 1 | G22: SYLVANIA | H22: LIGHTBULB | J22: =IF(C22+D22=0,B22,IF(D22="",B22*C22,IF(C22 ="",B22*D22))) -> 1
A23: food package | B23: 1 | G23: one Act | H23: popcorn | J23: =IF(C23+D23=0,B23,IF(D23="",B23*C23,IF(C23 ="",B23*D23))) -> 1
A24: food | B24: 1 | H24: coffee Grounds | J24: =IF(C24+D24=0,B24,IF(D24="",B24*C24,IF(C24 ="",B24*D24))) -> 1
A25: food | B25: 1 | H25: apple core | J25: =IF(C25+D25=0,B25,IF(D25="",B25*C25,IF(C25 ="",B25*D25))) -> 1
A26: food package | B26: 1 | G26: poptart | H26: pastery | J26: =IF(C26+D26=0,B26,IF(D26="",B26*C26,IF(C26 ="",B26*D26))) -> 1
A27: food package | B27: 1 | G27: Snickers | H27: funsize | J27: =IF(C27+D27=0,B27,IF(D27="",B27*C27,IF(C27 ="",B27*D27))) -> 1
A28: food package | B28: 1 | G28: folgers | H28: single servings | J28: =IF(C28+D28=0,B28,IF(D28="",B28*C28,IF(C28 ="",B28*D28))) -> 1
A29: dryer sheets | B29: 4 | H29: dryer sheets | J29: =IF(C29+D29=0,B29,IF(D29="",B29*C29,IF(C29 ="",B29*D29))) -> 4
A30: dryer lint | B30: 3 | J30: =IF(C30+D30=0,B30,IF(D30="",B30*C30,IF(C30 ="",B30*D30))) -> 3
A31: paper | B31: 1 | G31: Imatiion | H31: disk laber | I31: paper | J31: =IF(C31+D31=0,B31,IF(D31="",B31*C31,IF(C31 ="",B31*D31))) -> 1
A32: food package | B32: 1 | D32: 12 | G32: Dole | H32: frozen Concetrate | I32: Pineapple | J32: =IF(C32+D32=0,B32,IF(D32="",B32*C32,IF(C32 ="",B32*D32))) -> 12
A33: plastic | B33: 1 | H33: produce bag | J33: =IF(C33+D33=0,B33,IF(D33="",B33*C33,IF(C33 ="",B33*D33))) -> 1
A34: plastic | B34: 4 | H34: unidentifiable plastic bags | J34: =IF(C34+D34=0,B34,IF(D34="",B34*C34,IF(C34 ="",B34*D34))) -> 4
A35: fiol | B35: 1 | H35: fiol | I35: w. Meat Juice | J35: =IF(C35+D35=0,B35,IF(D35="",B35*C35,IF(C35 ="",B35*D35))) -> 1
A36: plant | B36: 7 | H36: dasies | J36: =IF(C36+D36=0,B36,IF(D36="",B36*C36,IF(C36 ="",B36*D36))) -> 7
A37: plant | B37: 3 | H37: carnations | J37: =IF(C37+D37=0,B37,IF(D37="",B37*C37,IF(C37 ="",B37*D37))) -> 3
A38: paper | B38: 1 | G38: Imperial Plastics | H38: Label | J38: =IF(C38+D38=0,B38,IF(D38="",B38*C38,IF(C38 ="",B38*D38))) -> 1
A39: fiol | B39: 1 | G39: Hershey | H39: Milk chocolate hershey Kiss | J39: =IF(C39+D39=0,B39,IF(D39="",B39*C39,IF(C39 ="",B39*D39))) -> 1
A40: metal | B40: 1 | G40: Thomas Kemper | H40: Soda | J40: =IF(C40+D40=0,B40,IF(D40="",B40*C40,IF(C40 ="",B40*D40))) -> 1
A41: food | B41: 1 | H41: salt watter Taffy | J41: =IF(C41+D41=0,B41,IF(D41="",B41*C41,IF(C41 ="",B41*D41))) -> 1
A42: paper | B42: 2 | H42: Facial Tissues | J42: =IF(C42+D42=0,B42,IF(D42="",B42*C42,IF(C42 ="",B42*D42))) -> 2
A43: paper | B43: 2 | H43: napkins | J43: =IF(C43+D43=0,B43,IF(D43="",B43*C43,IF(C43 ="",B43*D43))) -> 2
A44: food | B44: 3 | H44: egg shells | J44: =IF(C44+D44=0,B44,IF(D44="",B44*C44,IF(C44 ="",B44*D44))) -> 3
A45: plastic | B45: 1 | H45: tortilla wrapper | J45: =IF(C45+D45=0,B45,IF(D45="",B45*C45,IF(C45 ="",B45*D45))) -> 1
A48: Item Code | B48: count | C48: Fluid oz | D48: solid oz | E48: cost | F48: waste g | G48: brand | H48: type | I48: material | J48: totals | K48: comments
A49: 1 | B49: 1 | C49: 12 | G49: Miller Lite | H49: Bottle | I49: Glass | J49: =IF(C49+D49=0,B49,IF(D49="",B49*C49,IF(C49 ="",B49*D49))) -> 12
A50: 2 | B50: 1 | C50: 12 | G50: Belhaven | H50: Bottle | I50: Glass | J50: =IF(C50+D50=0,B50,IF(D50="",B50*C50,IF(C50 ="",B50*D50))) -> 12
A51: 3 | B51: 1 | C51: 64 | G51: Berkley Farms | H51: milk | I51: paper | J51: =IF(C51+D51=0,B51,IF(D51="",B51*C51,IF(C51 ="",B51*D51))) -> 64
A52: 4 | B52: 1 | C52: 16 | G52: Snapple | H52: tea | I52: glass | J52: =IF(C52+D52=0,B52,IF(D52="",B52*C52,IF(C52 ="",B52*D52))) -> 16
A53: 5 | B53: 1 | C53: 64 | G53: 7up | H53: bottle | I53: plastic | J53: =IF(C53+D53=0,B53,IF(D53="",B53*C53,IF(C53 ="",B53*D53))) -> 64
A54: 6 | B54: 1 | C54: 64 | G54: Barques | H54: Bottle | I54: plastic | J54: =IF(C54+D54=0,B54,IF(D54="",B54*C54,IF(C54 ="",B54*D54))) -> 64
A55: 7 | B55: 1 | G55: Kirkland | H55: Box | I55: paper | J55: =IF(C55+D55=0,B55,IF(D55="",B55*C55,IF(C55 ="",B55*D55))) -> 1
A56: 8 | B56: 2 | G56: Picture | H56: Picture | I56: paper | J56: =IF(C56+D56=0,B56,IF(D56="",B56*C56,IF(C56 ="",B56*D56))) -> 2 | K56: torn
A57: 9 | B57: 4 | G57: JunkMail | H57: Mail | I57: paper | J57: =IF(C57+D57=0,B57,IF(D57="",B57*C57,IF(C57 ="",B57*D57))) -> 4
A58: 10 | B58: 1 | G58: Costco | H58: Enveloope | I58: paper | J58: =IF(C58+D58=0,B58,IF(D58="",B58*C58,IF(C58 ="",B58*D58))) -> 1 | K58: Film Development
A59: 11 | B59: 1 | G59: oxford | H59: Box | I59: paper | J59: =IF(C59+D59=0,B59,IF(D59="",B59*C59,IF(C59 ="",B59*D59))) -> 1 | K59: Hanging Folders
A60: 12 | B60: 1 | G60: Daily Review | H60: NewsPaper | I60: paper | J60: =IF(C60+D60=0,B60,IF(D60="",B60*C60,IF(C60 ="",B60*D60))) -> 1 | K60: Easter Sunday
A61: 13 | B61: 1 | E61: 77.23 | G61: Taget Reciept | I61: paper | J61: =IF(C61+D61=0,B61,IF(D61="",B61*C61,IF(C61 ="",B61*D61))) -> 1 | K61: used Debit card
A62: 14 | B62: 1 | D62: 8.3 | G62: Kudos M&M | H62: box | I62: paper | J62: =IF(C62+D62=0,B62,IF(D62="",B62*C62,IF(C62 ="",B62*D62))) -> 8.3 | K62: 10 per box
A63: 15 | B63: 1 | G63: Cadet | H63: wraper | I63: paper | J63: =IF(C63+D63=0,B63,IF(D63="",B63*C63,IF(C63 ="",B63*D63))) -> 1 | K63: Rawhide Munch Stix
A64: 16 | B64: 1 | D64: 37 | G64: Betty Croker | H64: Box | I64: paper | J64: =IF(C64+D64=0,B64,IF(D64="",B64*C64,IF(C64 ="",B64*D64))) -> 37 | K64: Pancake Mix
A65: 17 | B65: 1 | D65: 10 | G65: Morning Star | H65: box | I65: paper | J65: =IF(C65+D65=0,B65,IF(D65="",B65*C65,IF(C65 ="",B65*D65))) -> 10 | K65: Veggy Corndogs
A66: 18 | B66: 2 | D66: 18.25 | G66: Betty Croker | H66: box` | I66: paper | J66: =IF(C66+D66=0,B66,IF(D66="",B66*C66,IF(C66 ="",B66*D66))) -> 36.5 | K66: Cake mix
A67: 19 | B67: 1 | G67: Sweet Tarts | H67: bag | I67: plastic | J67: =IF(C67+D67=0,B67,IF(D67="",B67*C67,IF(C67 ="",B67*D67))) -> 1 | K67: Chicks, Ducks & Bunnies
A68: 20 | B68: 2 | G68: Apple Cores | H68: fruit | I68: fruit | J68: =IF(C68+D68=0,B68,IF(D68="",B68*C68,IF(C68 ="",B68*D68))) -> 2
A69: 21 | B69: 2 | E69: 4.99 x 2 | G69: Flower Wrap | H69: wraper | I69: plastic | J69: =IF(C69+D69=0,B69,IF(D69="",B69*C69,IF(C69 ="",B69*D69))) -> 2
A70: 22 | B70: 1 | G70: safeway | H70: bag | I70: plastic | J70: =IF(C70+D70=0,B70,IF(D70="",B70*C70,IF(C70 ="",B70*D70))) -> 1 | K70: shopping bag
A71: 23 | B71: 1 | G71: Ord Market | H71: bag | I71: plastic | J71: =IF(C71+D71=0,B71,IF(D71="",B71*C71,IF(C71 ="",B71*D71))) -> 1 | K71: shopping bag
A72: 24 | B72: 1 | G72: Floggy Molly | H72: CD | I72: plastic | J72: =IF(C72+D72=0,B72,IF(D72="",B72*C72,IF(C72 ="",B72*D72))) -> 1 | K72: Complete Box
A73: 25 | B73: 1 | D73: 6 | G73: Chicken of the Sea | H73: Can | I73: Aluminum | J73: =IF(C73+D73=0,B73,IF(D73="",B73*C73,IF(C73 ="",B73*D73))) -> 6 | K73: Tuna in Water
A74: 26 | B74: 2 | G74: Crystal Lite | H74: Container | I74: plastic | J74: =IF(C74+D74=0,B74,IF(D74="",B74*C74,IF(C74 ="",B74*D74))) -> 2 | K74: Powder
A75: 27 | B75: 3 | G75: Lemons | H75: fruit | I75: fruit | J75: =IF(C75+D75=0,B75,IF(D75="",B75*C75,IF(C75 ="",B75*D75))) -> 3
A76: 28 | B76: 1 | G76: Orange | H76: fruit | I76: fruit | J76: =IF(C76+D76=0,B76,IF(D76="",B76*C76,IF(C76 ="",B76*D76))) -> 1
A77: 29 | B77: 1 | G77: Greeting Card | H77: Card | I77: paper | J77: =IF(C77+D77=0,B77,IF(D77="",B77*C77,IF(C77 ="",B77*D77))) -> 1 | K77: Thinking of You
A78: 30 | B78: 1 | G78: Flyer | I78: paper | J78: =IF(C78+D78=0,B78,IF(D78="",B78*C78,IF(C78 ="",B78*D78))) -> 1 | K78: Reservation Week
A79: 31 | B79: 1 | D79: 1.45 | G79: Albersons | H79: package | I79: Styrofoam | J79: =IF(C79+D79=0,B79,IF(D79="",B79*C79,IF(C79 ="",B79*D79))) -> 1.45
A80: 32 | B80: 1 | D80: 1.05 | G80: St James Court | H80: Box | I80: Wood | J80: =IF(C80+D80=0,B80,IF(D80="",B80*C80,IF(C80 ="",B80*D80))) -> 1.05 | K80: Tea
A81: 33 | B81: 1 | C81: 20 | G81: In&Out | H81: Cup | I81: paper | J81: =IF(C81+D81=0,B81,IF(D81="",B81*C81,IF(C81 ="",B81*D81))) -> 20 | K81: soda
A82: 34 | B82: 6 | G82: Starburst | H82: Wrapper | I82: paper | J82: =IF(C82+D82=0,B82,IF(D82="",B82*C82,IF(C82 ="",B82*D82))) -> 6 | K82: individual wraps
A83: 35 | B83: 1 | D83: 2.07 | G83: Starburst | H83: Wrapper | I83: Aluminum | J83: =IF(C83+D83=0,B83,IF(D83="",B83*C83,IF(C83 ="",B83*D83))) -> 2.07
A84: 36 | B84: 1 | D84: 14.75 | G84: Paper Plate | H84: Plate | I84: paper | J84: =IF(C84+D84=0,B84,IF(D84="",B84*C84,IF(C84 ="",B84*D84))) -> 14.75 | K84: Food Leftover
A85: 37 | B85: 1 | G85: Spaghetti Os | H85: Can | I85: Aluminum | J85: =IF(C85+D85=0,B85,IF(D85="",B85*C85,IF(C85 ="",B85*D85))) -> 1
A86: 38 | B86: 1 | G86: Dog Toy | H86: Toy | I86: Fabric and Rope | J86: =IF(C86+D86=0,B86,IF(D86="",B86*C86,IF(C86 ="",B86*D86))) -> 1
A87: 39 | B87: 1 | G87: Cust Plus | H87: package | I87: paper | J87: =IF(C87+D87=0,B87,IF(D87="",B87*C87,IF(C87 ="",B87*D87))) -> 1 | K87: 100 Skewers
A88: 40 | B88: 10 | G88: Skewers | I88: wood | J88: =IF(C88+D88=0,B88,IF(D88="",B88*C88,IF(C88 ="",B88*D88))) -> 10
A89: 41 | B89: 11 | G89: Flower Parts | I89: plant | J89: =IF(C89+D89=0,B89,IF(D89="",B89*C89,IF(C89 ="",B89*D89))) -> 11 | K89: bits
A90: 42 | B90: 5 | G90: Bottle Caps | H90: Caps | I90: Aluminum | J90: =IF(C90+D90=0,B90,IF(D90="",B90*C90,IF(C90 ="",B90*D90))) -> 5 | K90: 2 Miller, 2 Henry, 1 Hefeweizen
A91: 43 | B91: 1 | G91: Krafft Easy Mac | H91: wrap | I91: plastic | J91: =IF(C91+D91=0,B91,IF(D91="",B91*C91,IF(C91 ="",B91*D91))) -> 1
A92: 44 | B92: 1 | G92: Floral Ways | H92: wrap | I92: plastic | J92: =IF(C92+D92=0,B92,IF(D92="",B92*C92,IF(C92 ="",B92*D92))) -> 1 | K92: Flower Food
A93: 45 | B93: 1 | G93: Bank of The West | H93: Deposit Slip | I93: paper | J93: =IF(C93+D93=0,B93,IF(D93="",B93*C93,IF(C93 ="",B93*D93))) -> 1
A94: 46 | B94: 1 | G94: See's | H94: wrap | I94: plastic | J94: =IF(C94+D94=0,B94,IF(D94="",B94*C94,IF(C94 ="",B94*D94))) -> 1 | K94: Cinamon and Candy
A95: 47 | B95: 1 | D95: 1.15 | G95: Chex Morning Mix | H95: wrap | I95: plastic | J95: =IF(C95+D95=0,B95,IF(D95="",B95*C95,IF(C95 ="",B95*D95))) -> 1.15 | K95: Honey nut
A96: 48 | B96: 3 | G96: Tea Bag | H96: bag | I96: cotton | J96: =IF(C96+D96=0,B96,IF(D96="",B96*C96,IF(C96 ="",B96*D96))) -> 3 | K96: Tea
A97: 49 | B97: 1 | G97: Kirkland | H97: Package | I97: plastic | J97: =IF(C97+D97=0,B97,IF(D97="",B97*C97,IF(C97 ="",B97*D97))) -> 1 | K97: Tissue/open Foil
A98: 50 | B98: 2 | E98: 14.95 | G98: Coffe Filters+Grounds | H98: Filter | I98: cotton | J98: =IF(C98+D98=0,B98,IF(D98="",B98*C98,IF(C98 ="",B98*D98))) -> 2
A99: 51 | B99: 1 | G99: Timberland | H99: tag | I99: paper | J99: =IF(C99+D99=0,B99,IF(D99="",B99*C99,IF(C99 ="",B99*D99))) -> 1
A100: 52 | B100: 1 | G100: Cerial Bag | H100: Bag | I100: plastic | J100: =IF(C100+D100=0,B100,IF(D100="",B100*C100,IF(C100 ="",B100*D100))) -> 1
A101: 53 | B101: 3 | G101: Valet Tag | H101: tag | I101: paper | J101: =IF(C101+D101=0,B101,IF(D101="",B101*C101,IF(C101 ="",B101*D101))) -> 3 | K101: Chevy, Lexux, Honda
A102: 54 | B102: 4 | G102: Aluminum Foil | H102: Foil | I102: Aluminum | J102: =IF(C102+D102=0,B102,IF(D102="",B102*C102,IF(C102 ="",B102*D102))) -> 4
A103: 55 | B103: 1 | G103: See's Gift Wrap | I103: paper | J103: =IF(C103+D103=0,B103,IF(D103="",B103*C103,IF(C103 ="",B103*D103))) -> 1
A104: 56 | B104: 3 | G104: Misa Plastic | H104: Wrapper | I104: plastic | J104: =IF(C104+D104=0,B104,IF(D104="",B104*C104,IF(C104 ="",B104*D104))) -> 3
A105: 57 | B105: 2 | G105: Dryer Sheets | I105: cotton | J105: =IF(C105+D105=0,B105,IF(D105="",B105*C105,IF(C105 ="",B105*D105))) -> 2
A106: 58 | B106: 1 | G106: Corad | H106: Bandage | I106: plastic | J106: =IF(C106+D106=0,B106,IF(D106="",B106*C106,IF(C106 ="",B106*D106))) -> 1 | K106: Bandage
A107: 59 | B107: 1 | G107: Tissue | I107: paper | J107: =IF(C107+D107=0,B107,IF(D107="",B107*C107,IF(C107 ="",B107*D107))) -> 1 | K107: w/blood
A108: 60 | B108: 3 | G108: Butcher Paper | I108: paper | J108: =IF(C108+D108=0,B108,IF(D108="",B108*C108,IF(C108 ="",B108*D108))) -> 3
A109: 61 | B109: 1 | G109: Weed | H109: plant | I109: plant | J109: =IF(C109+D109=0,B109,IF(D109="",B109*C109,IF(C109 ="",B109*D109))) -> 1
A110: 62 | B110: 4 | G110: Garbage Twists | I110: Aluminum | J110: =IF(C110+D110=0,B110,IF(D110="",B110*C110,IF(C110 ="",B110*D110))) -> 4
A111: 63 | B111: 1 | G111: Rice Bag | H111: wrapper | I111: plasic | J111: =IF(C111+D111=0,B111,IF(D111="",B111*C111,IF(C111 ="",B111*D111))) -> 1
A112: 64 | B112: 1 | G112: Cigar | I112: tabacco | J112: =IF(C112+D112=0,B112,IF(D112="",B112*C112,IF(C112 ="",B112*D112))) -> 1
A113: 65 | B113: 5 | G113: Napkins | I113: paper | J113: =IF(C113+D113=0,B113,IF(D113="",B113*C113,IF(C113 ="",B113*D113))) -> 5
A114: 66 | B114: 1 | G114: Note | I114: paper | J114: =IF(C114+D114=0,B114,IF(D114="",B114*C114,IF(C114 ="",B114*D114))) -> 1
A115: 67 | B115: 1 | G115: paper bag | H115: bag | I115: paper | J115: =IF(C115+D115=0,B115,IF(D115="",B115*C115,IF(C115 ="",B115*D115))) -> 1
A116: 68 | B116: 3 | G116: Hersheys kisses | H116: wraper | I116: Aluminum | J116: =IF(C116+D116=0,B116,IF(D116="",B116*C116,IF(C116 ="",B116*D116))) -> 3
A117: 69 | B117: 1 | G117: bread bag clip | I117: plasic | J117: =IF(C117+D117=0,B117,IF(D117="",B117*C117,IF(C117 ="",B117*D117))) -> 1
A118: 70 | B118: 1 | G118: metal cunductor | I118: metal | J118: =IF(C118+D118=0,B118,IF(D118="",B118*C118,IF(C118 ="",B118*D118))) -> 1
A120: Item Code | B120: count | C120: Fluid oz | D120: solid oz | E120: cost | F120: waste g | G120: brand | H120: type | I120: material | J120: totals | K120: comments
A121: 1 | B121: 17 | G121: Junk Mail | H121: Mail | I121: Paper | J121: =IF(C121+D121=0,B121,IF(D121="",B121*C121,IF(C121 ="",B121*D121))) -> 17
A122: 2 | B122: 3 | C122: 12 | G122: Henry's Hard Lemonade | H122: Bottle | I122: Glass | J122: =IF(C122+D122=0,B122,IF(D122="",B122*C122,IF(C122 ="",B122*D122))) -> 36
A123: 3 | B123: 1 | C123: 64 | G123: Slice | H123: Bottle | I123: Plastic | J123: =IF(C123+D123=0,B123,IF(D123="",B123*C123,IF(C123 ="",B123*D123))) -> 64
A124: 4 | B124: 1 | G124: Toilet Paper Roll | H124: Roll Core | I124: Paper | J124: =IF(C124+D124=0,B124,IF(D124="",B124*C124,IF(C124 ="",B124*D124))) -> 1
A125: 5 | B125: 1 | G125: TDK CD | H125: CD-R | I125: Plastic | J125: =IF(C125+D125=0,B125,IF(D125="",B125*C125,IF(C125 ="",B125*D125))) -> 1 | K125: 50 CD Spindle
A126: 6 | B126: 1 | D126: 10 | G126: Morningstar Burgers | H126: box | I126: Paper | J126: =IF(C126+D126=0,B126,IF(D126="",B126*C126,IF(C126 ="",B126*D126))) -> 10
A127: 7 | B127: 1 | G127: Kirkland | H127: box | I127: paper | J127: =IF(C127+D127=0,B127,IF(D127="",B127*C127,IF(C127 ="",B127*D127))) -> 1 | K127: tissue
A128: 8 | B128: 1 | G128: Target Hangers | H128: Hanger | I128: Plastic | J128: =IF(C128+D128=0,B128,IF(D128="",B128*C128,IF(C128 ="",B128*D128))) -> 1 | K128: L
A129: 9 | B129: 1 | D129: 80 | G129: Ghiradelli Chocolate Brownie Mix | H129: Box | I129: Paper | J129: =IF(C129+D129=0,B129,IF(D129="",B129*C129,IF(C129 ="",B129*D129))) -> 80
A130: 10 | B130: 1 | D130: 6 | G130: Jello | H130: box | I130: Paper | J130: =IF(C130+D130=0,B130,IF(D130="",B130*C130,IF(C130 ="",B130*D130))) -> 6 | K130: strawberry
A131: 11 | B131: 1 | D131: 26.6 | G131: Kudos Granola Bar | H131: box | I131: Paper | J131: =IF(C131+D131=0,B131,IF(D131="",B131*C131,IF(C131 ="",B131*D131))) -> 26.6 | K131: varaity
A132: 12 | B132: 1 | G132: celofane | H132: wraper | I132: ceolfane | J132: =IF(C132+D132=0,B132,IF(D132="",B132*C132,IF(C132 ="",B132*D132))) -> 1
A133: 13 | B133: 1 | D133: 16 | G133: Albersons Light Brown Shugar | H133: box | I133: Paper | J133: =IF(C133+D133=0,B133,IF(D133="",B133*C133,IF(C133 ="",B133*D133))) -> 16
A134: 14 | B134: 1 | D134: 2.1 | G134: Purina Whiskers tartar controll | H134: bag | I134: foil | J134: =IF(C134+D134=0,B134,IF(D134="",B134*C134,IF(C134 ="",B134*D134))) -> 2.1 | K134: cat/tuna flavor
A135: 15 | B135: 1 | G135: Animal medicine bag | H135: bag | I135: Plastic | J135: =IF(C135+D135=0,B135,IF(D135="",B135*C135,IF(C135 ="",B135*D135))) -> 1
A136: 16 | B136: 1 | C136: 1 | G136: Boston Tea | H136: box | I136: paper | J136: =IF(C136+D136=0,B136,IF(D136="",B136*C136,IF(C136 ="",B136*D136))) -> 1 | K136: orange spice
A137: 17 | B137: 1 | G137: Twinnings Tea Bag | H137: sleve | I137: Paper | J137: =IF(C137+D137=0,B137,IF(D137="",B137*C137,IF(C137 ="",B137*D137))) -> 1 | K137: Lady Grey
A138: 18 | B138: 1 | G138: Rotten Abble | H138: fruit | I138: Fruit | J138: =IF(C138+D138=0,B138,IF(D138="",B138*C138,IF(C138 ="",B138*D138))) -> 1
A139: 19 | B139: 1 | G139: Applecore | H139: fruit | I139: Fruit | J139: =IF(C139+D139=0,B139,IF(D139="",B139*C139,IF(C139 ="",B139*D139))) -> 1
A140: 20 | B140: 1 | G140: Orange Peel | H140: Fruit | I140: Peel | J140: =IF(C140+D140=0,B140,IF(D140="",B140*C140,IF(C140 ="",B140*D140))) -> 1
A141: 21 | B141: 1 | G141: Boston Tea | H141: Tea Bag | I141: cotton | J141: =IF(C141+D141=0,B141,IF(D141="",B141*C141,IF(C141 ="",B141*D141))) -> 1 | K141: Orange spice
A142: 22 | B142: 1 | G142: Onion Peels | H142: vegetable | I142: vegetable | J142: =IF(C142+D142=0,B142,IF(D142="",B142*C142,IF(C142 ="",B142*D142))) -> 1
A143: 23 | B143: 1 | G143: Dixie Soda Lid | H143: lid | I143: Plastic | J143: =IF(C143+D143=0,B143,IF(D143="",B143*C143,IF(C143 ="",B143*D143))) -> 1
A144: 24 | B144: 1 | G144: Vlastic Pickle | H144: lid | I144: metal | J144: =IF(C144+D144=0,B144,IF(D144="",B144*C144,IF(C144 ="",B144*D144))) -> 1
A145: 25 | B145: 3 | G145: Hersheys Miniature wrapers | H145: wraper | I145: foil | J145: =IF(C145+D145=0,B145,IF(D145="",B145*C145,IF(C145 ="",B145*D145))) -> 3
A146: 26 | B146: 1 | G146: vacuum cleaner refuse | J146: =IF(C146+D146=0,B146,IF(D146="",B146*C146,IF(C146 ="",B146*D146))) -> 1
A147: 27 | B147: 4 | G147: paper towels | H147: paper | I147: Paper | J147: =IF(C147+D147=0,B147,IF(D147="",B147*C147,IF(C147 ="",B147*D147))) -> 4
A148: 28 | B148: 3 | G148: plasic bags | H148: bags | I148: Plastic | J148: =IF(C148+D148=0,B148,IF(D148="",B148*C148,IF(C148 ="",B148*D148))) -> 3
A149: 29 | B149: 1 | G149: weed | H149: plant | I149: plant | J149: =IF(C149+D149=0,B149,IF(D149="",B149*C149,IF(C149 ="",B149*D149))) -> 1
A150: 30 | B150: 1 | G150: plasic padding( | H150: sheet | I150: Plastic | J150: =IF(C150+D150=0,B150,IF(D150="",B150*C150,IF(C150 ="",B150*D150))) -> 1
A151: 31 | B151: 1 | C151: 16 | G151: soup cup | H151: cup | I151: paper | J151: =IF(C151+D151=0,B151,IF(D151="",B151*C151,IF(C151 ="",B151*D151))) -> 16
A152: 32 | B152: 1 | G152: paper scrap | H152: paper | I152: Paper | J152: =IF(C152+D152=0,B152,IF(D152="",B152*C152,IF(C152 ="",B152*D152))) -> 1