A1: Group ID | B1: Total Weight | C1: Collection Date | D1: Analysis Date | E1: Source | F1: Recorder(s) | I1: Garbage Project Survey Data | M1: Group Members
A2: Group 1 | C2: 37328 | D2: 37329 | F2: B. Fowler | I2: Spring 2002 Survey | M2: Paula Acojido
A3: A: | B3: B: | C3: C: | D3: D: | E3: E: | F3: F: | G3: G: | H3: H: | I3: I: | J3: J: | M3: Amanda Miles
A4: Item Code | C4: Fluid Ounces | D4: Solid Ounces | E4: Cost | F4: Waste gms. | G4: Brand | H4: Type | I4: Material | J4: Totals, BxC or D | M4: C Crazyhorse
A5: 1 | B5: 10 | I5: D | J5: =SUM(C5:D5) -> 0 | M5: Peter Williams
A6: 2 | B6: 3 | H6: Mail | I6: A | J6: =SUM(C6:D6) -> 0 | M6: Ryan Robertson
A7: 3 | B7: 12 | H7: Newspapers | I7: A | J7: =SUM(C7:D7) -> 0 | M7: Jenny Petit
A8: 4 | B8: 15 | H8: Coloring Bk | I8: A | J8: =SUM(C8:D8) -> 0 | M8: Joya De Simone
A9: 5 | B9: 9 | G9: Lipton | H9: tea bags | I9: X | J9: =SUM(C9:D9) -> 0
A10: 6 | B10: 3 | D10: 4 | G10: Dannon | H10: Yogurt | I10: D | J10: =SUM(C10:D10) -> 4
A11: 7 | B11: 1 | D11: 3 | G11: Siilia | H11: Lemon Juice | I11: D | J11: =SUM(C11:D11) -> 3
A12: 8 | B12: 1 | D12: 14.5 | G12: S&W | H12: Grn Beans | I12: C | J12: =SUM(C12:D12) -> 14.5
A13: 9 | B13: 1 | D13: 5lb | G13: Sunny Select | H13: Sugar | I13: A | J13: =SUM(C13:D13) -> 0
A14: 10 | B14: 3 | H14: tomatoes | I14: X | J14: =SUM(C14:D14) -> 0
A15: 11 | B15: 7 | H15: spinach | I15: X | J15: =SUM(C15:D15) -> 0
A16: 12 | B16: 5 | H16: Muffin Cups | I16: A | J16: =SUM(C16:D16) -> 0
A17: 13 | B17: 16 | H17: Kleenex | I17: A | J17: =SUM(C17:D17) -> 0
A18: 14 | B18: 2 | D18: 2.32 | H18: TV Dinners | I18: A | J18: =SUM(C18:D18) -> 2.32
A19: 15 | B19: 5 | H19: Cups | I19: A | J19: =SUM(C19:D19) -> 0
A20: 16 | B20: 2 | H20: Foil | I20: C | J20: =SUM(C20:D20) -> 0
A21: 17 | B21: 1 | D21: 3 | G21: Hostess | H21: Wrappers | I21: D | J21: =SUM(C21:D21) -> 3
A22: 18 | B22: 1 | D22: 1.3 | G22: Quaker | H22: " | I22: D | J22: =SUM(C22:D22) -> 1.3
A23: 19 | B23: 1 | D23: 1.7 | H23: " | I23: D | J23: =SUM(C23:D23) -> 1.7
A24: 20 | B24: 1 | D24: 4 | H24: Meat | I24: X | J24: =SUM(C24:D24) -> 4
A25: 21 | B25: 1 | G25: Tylenol | H25: Medication | I25: X | J25: =SUM(C25:D25) -> 0
A26: 22 | B26: 1.5 | H26: PBJ Sandwich | I26: X | J26: =SUM(C26:D26) -> 0
A27: 23 | B27: 1/2 Cup | D27: 4 | H27: Spaghetti | I27: X | J27: =SUM(C27:D27) -> 4
A28: 24 | B28: 12 | D28: 0.5 | H28: Walnut | I28: X | J28: =SUM(C28:D28) -> 0.5
A29: 25 | D29: 0.5 | H29: Cheese | I29: X | J29: =SUM(C29:D29) -> 0.5
A30: 26 | B30: 1 slice | H30: Pep. Pizza | I30: A | J30: =SUM(C30:D30) -> 0
A31: 27 | B31: 5 | G31: Vanilla Fingers | H31: Cookies | I31: X | J31: =SUM(C31:D31) -> 0
A32: 28 | B32: 12 chips | H32: Tortilla Chips | I32: X | J32: =SUM(C32:D32) -> 0
A33: 29 | B33: 3 | G33: Ritz | H33: Crackers | I33: X | J33: =SUM(C33:D33) -> 0
A34: 30 | J34: =SUM(C34:D34) -> 0
A35: 31 | J35: =SUM(C35:D35) -> 0
A36: 32 | J36: =SUM(C36:D36) -> 0
A37: 33 | J37: =SUM(C37:D37) -> 0
A38: 34 | J38: =SUM(C38:D38) -> 0
A39: 35 | J39: =SUM(C39:D39) -> 0
A40: 36 | J40: =SUM(C40:D40) -> 0
A41: 37 | J41: =SUM(C41:D41) -> 0
A42: 38 | J42: =SUM(C42:D42) -> 0
A43: 39 | J43: =SUM(C43:D43) -> 0
A44: 40 | J44: =SUM(C44:D44) -> 0

A1: Count