A1: Group ID | B1: Total Weight | C1: Collection Date | D1: Analysis Date | E1: Source | F1: Recorder(s) | I1: Garbage Project Survey Data | M1: Group Members
A2: Group 3 | C2: 37328 | D2: 37329 | F2: B. Fowler | I2: Spring 2002 Survey | M2: Doliska Johnson
A3: A: | B3: B: | C3: C: | D3: D: | E3: E: | F3: F: | G3: G: | H3: H: | I3: I: | J3: J: | M3: Ben Freer
A4: Item Code | B4: Count | C4: Fluid Ounces | D4: Solid Ounces | E4: Cost | F4: Waste gms. | G4: Brand | H4: Type | I4: Material | J4: Totals, BxC or D | M4: Brian Laatsch
A5: 1 | B5: 5 | G5: Goldfish | J5: =SUM(C5:D5) -> 0 | M5: Nathan Duckett-Flaherty
A6: 2 | B6: 1 | D6: 1.3 | G6: Quaker | J6: =SUM(C6:D6) -> 1.3 | M6: Craig Ventuleth
A7: 3 | B7: 1 | D7: 1.7 | G7: Hershey | J7: =SUM(C7:D7) -> 1.7 | M7: Adrianna Perez
A8: 4 | B8: 1 | D8: 3 | G8: Hostess | J8: =SUM(C8:D8) -> 3 | M8: Amardip Basra
A9: 5 | B9: 8 | G9: Lipton | J9: =SUM(C9:D9) -> 0 | M9: Shannon McElfresh
A10: 6 | B10: 9 | G10: Lipton | I10: A | J10: =SUM(C10:D10) -> 0
A11: 7 | B11: 1 | D11: 9.2 | G11: "Weight Watchers" | I11: A | J11: =SUM(C11:D11) -> 9.2
A12: 8 | B12: 1 | D12: 2lbs | G12: Miltons | I12: A | J12: =SUM(C12:D12) -> 0
A13: 9 | B13: 18 | I13: A | J13: =SUM(C13:D13) -> 0
A14: 10 | B14: 1 | E14: 1 | G14: Barbie | I14: A | J14: =SUM(C14:D14) -> 0
A15: 11 | G15: Sunny Select | J15: =SUM(C15:D15) -> 0
A16: 12 | B16: 1 | D16: 5lbs | G16: Pork | I16: A | J16: =SUM(C16:D16) -> 0
A17: 13 | B17: 1 | D17: 6 | G17: Tomatoes | I17: X | J17: =SUM(C17:D17) -> 6
A18: 14 | B18: 3 | D18: 3 | G18: Sandwichs (PBJ) | J18: =SUM(C18:D18) -> 3
A19: 15 | B19: 2 | D19: 1 | G19: Avacado | J19: =SUM(C19:D19) -> 1
A20: 16 | B20: 0.5 | G20: Tissue | J20: =SUM(C20:D20) -> 0
A21: 17 | B21: 15 | G21: Muffin Wrappers | J21: =SUM(C21:D21) -> 0
A22: 18 | B22: 5 | G22: Dannon | J22: =SUM(C22:D22) -> 0
A23: 19 | B23: 3 | D23: 4 | G23: Spaghetti | J23: =SUM(C23:D23) -> 4
A24: 20 | B24: 1bg | D24: 2 | G24: Pizza | J24: =SUM(C24:D24) -> 2
A25: 21 | B25: 8 | G25: Tortilla Chips | J25: =SUM(C25:D25) -> 0
A26: 22 | B26: 6 | D26: 3 | G26: Plastic Wrappers | J26: =SUM(C26:D26) -> 3
A27: 23 | B27: 1 | G27: Vienna Fingers | J27: =SUM(C27:D27) -> 0
A28: 24 | B28: 10 | G28: Lime Juice | J28: =SUM(C28:D28) -> 0
A29: 25 | B29: 8 | D29: 1.3 | G29: Personal Mail | J29: =SUM(C29:D29) -> 1.3
A30: 26 | B30: 1 | G30: Junk Mail | J30: =SUM(C30:D30) -> 0
A31: 27 | B31: 5 | G31: S&W | J31: =SUM(C31:D31) -> 0
A32: 28 | B32: 4 | D32: 14.5 | G32: Paper Cups | J32: =SUM(C32:D32) -> 14.5
A33: 29 | B33: 1 | G33: Paper Plates | J33: =SUM(C33:D33) -> 0
A34: 30 | B34: 4 | G34: TV dinner tray | J34: =SUM(C34:D34) -> 0
A35: 31 | B35: 1 | G35: Foil | J35: =SUM(C35:D35) -> 0
A36: 32 | B36: 10 leafs | G36: Tylenol Sinus | J36: =SUM(C36:D36) -> 0
A37: 33 | B37: 3 | G37: Spinich | J37: =SUM(C37:D37) -> 0
A38: 34 | B38: 15 | D38: 0.5 | G38: Mashed potatoes | J38: =SUM(C38:D38) -> 0.5
A39: 35 | D39: 0.5 | G39: Walnuts | J39: =SUM(C39:D39) -> 0.5
A40: 36 | D40: 5 | G40: Cheese | J40: =SUM(C40:D40) -> 5
A41: 37 | G41: Lent | J41: =SUM(C41:D41) -> 0
A42: 38 | J42: =SUM(C42:D42) -> 0
A43: 39 | J43: =SUM(C43:D43) -> 0
A44: 40 | J44: =SUM(C44:D44) -> 0