A1: Group ID | B1: Total Weight | C1: Collection Date | D1: Analysis Date | E1: Source | F1: Recorder(s) | I1: Garbage Project Survey Data
A2: group 3 | C2: 37342 | D2: 37343 | F2: dionne/doliska | I2: Spring 2002 Survey
A3: A: | B3: B: | C3: C: | D3: D: | E3: E: | F3: F: | G3: G: | H3: H: | I3: I: | J3: J: | K3: Group members: | L3: Rachel Jost
A4: Item Code | B4: Count | C4: Fluid Ounces | D4: Solid Ounces | E4: Cost | F4: Waste gms. | G4: Brand | H4: Type | I4: Material | J4: Totals, BxC or D | K4: Comments | L4: Melissa Dellens
A5: food package | B5: 2 | D5: 12 | G5: Albertsons, western Family | H5: food pazckage | I5: Cardboard | J5: =IF(C5+D5=0,B5,IF(D5="",B5*C5,IF(C5 ="",B5*D5))) -> 24 | L5: Chris Eichermueller
A6: paper | B6: 17 | D6: 2 | E6: free | H6: junk mail | J6: =IF(C6+D6=0,B6,IF(D6="",B6*C6,IF(C6 ="",B6*D6))) -> 34 | L6: Annie Wehrli
A7: air freshner | B7: 1 | G7: wizard | H7: scented oil | I7: plastic, cardboard | J7: =IF(C7+D7=0,B7,IF(D7="",B7*C7,IF(C7 ="",B7*D7))) -> 1 | L7: Amy Gottschlak-Stein
A8: air freshner | B8: 1 | G8: wizard, Refill | H8: scented oil | I8: plastic, cardboard | J8: =IF(C8+D8=0,B8,IF(D8="",B8*C8,IF(C8 ="",B8*D8))) -> 1 | L8: Evan Wynns
A9: food package | B9: 1 | D9: 9 | G9: Morning Star Farms | H9: food Package | I9: cardboard | J9: =IF(C9+D9=0,B9,IF(D9="",B9*C9,IF(C9 ="",B9*D9))) -> 9 | K9: veggie Burger
A10: food package | B10: 1 | D10: 31.4 | G10: kellog | H10: food Package | I10: Cardboard | J10: =IF(C10+D10=0,B10,IF(D10="",B10*C10,IF(C10 ="",B10*D10))) -> 31.4 | K10: cinimon Crunch Crispix
A11: plastic | B11: 1 | G11: Clean ones | J11: =IF(C11+D11=0,B11,IF(D11="",B11*C11,IF(C11 ="",B11*D11))) -> 1 | K11: latex Gloves
A12: food package | B12: 1 | C12: 64 | G12: Foster Farms | H12: food Package | I12: Cardboard | J12: =IF(C12+D12=0,B12,IF(D12="",B12*C12,IF(C12 ="",B12*D12))) -> 64 | K12: milk
A13: food package | B13: 1 | G13: KFC | H13: food Package | I13: Cardboard | J13: =IF(C13+D13=0,B13,IF(D13="",B13*C13,IF(C13 ="",B13*D13))) -> 1 | K13: Biscuits
A14: food package | B14: 1 | D14: 8 | G14: Arm & Hammer | H14: food Package | I14: Cardboard | J14: =IF(C14+D14=0,B14,IF(D14="",B14*C14,IF(C14 ="",B14*D14))) -> 8 | K14: Baking Soda
A15: food package | B15: 1 | D15: 6.9 | G15: chex | H15: food | I15: Cardboard | J15: =IF(C15+D15=0,B15,IF(D15="",B15*C15,IF(C15 ="",B15*D15))) -> 6.9
A16: toy | B16: 1 | G16: Bubbling Gl | H16: toy | I16: Cardboard | J16: =IF(C16+D16=0,B16,IF(D16="",B16*C16,IF(C16 ="",B16*D16))) -> 1
A17: packaging | B17: 1 | G17: Energy Choice | H17: light Bulbs | J17: =IF(C17+D17=0,B17,IF(D17="",B17*C17,IF(C17 ="",B17*D17))) -> 1
A18: packaging | B18: 1 | G18: hefty | H18: garbage bags | J18: =IF(C18+D18=0,B18,IF(D18="",B18*C18,IF(C18 ="",B18*D18))) -> 1
A19: packaging | B19: 1 | G19: Fram | H19: Car Air Filter | J19: =IF(C19+D19=0,B19,IF(D19="",B19*C19,IF(C19 ="",B19*D19))) -> 1
A20: packaging | B20: 1 | G20: fram | H20: oil filter | J20: =IF(C20+D20=0,B20,IF(D20="",B20*C20,IF(C20 ="",B20*D20))) -> 1
A21: packaging | B21: 1 | G21: penzoil | H21: oil filter rench | J21: =IF(C21+D21=0,B21,IF(D21="",B21*C21,IF(C21 ="",B21*D21))) -> 1
A22: PACKAGING | B22: 5 | C22: 32 | G22: CASTROL | H22: MOTEROIL | J22: =IF(C22+D22=0,B22,IF(D22="",B22*C22,IF(C22 ="",B22*D22))) -> 160
A23: food package | B23: 1 | D23: 5 | G23: Nevada High desert | H23: onions | J23: =IF(C23+D23=0,B23,IF(D23="",B23*C23,IF(C23 ="",B23*D23))) -> 5 | K23: lb
A24: food package | B24: 1 | G24: duchess | H24: tea | J24: =IF(C24+D24=0,B24,IF(D24="",B24*C24,IF(C24 ="",B24*D24))) -> 1
A25: lightbulb | B25: 1 | G25: SYLVANIA | H25: LIGHTBULB | J25: =IF(C25+D25=0,B25,IF(D25="",B25*C25,IF(C25 ="",B25*D25))) -> 1
A26: food package | B26: 1 | G26: one Act | H26: popcorn | J26: =IF(C26+D26=0,B26,IF(D26="",B26*C26,IF(C26 ="",B26*D26))) -> 1
A27: food | B27: 1 | H27: coffee Grounds | J27: =IF(C27+D27=0,B27,IF(D27="",B27*C27,IF(C27 ="",B27*D27))) -> 1
A28: food | B28: 1 | H28: apple core | J28: =IF(C28+D28=0,B28,IF(D28="",B28*C28,IF(C28 ="",B28*D28))) -> 1
A29: food package | B29: 1 | G29: poptart | H29: pastery | J29: =IF(C29+D29=0,B29,IF(D29="",B29*C29,IF(C29 ="",B29*D29))) -> 1
A30: food package | B30: 1 | G30: Snickers | H30: funsize | J30: =IF(C30+D30=0,B30,IF(D30="",B30*C30,IF(C30 ="",B30*D30))) -> 1
A31: food package | B31: 1 | G31: folgers | H31: single servings | J31: =IF(C31+D31=0,B31,IF(D31="",B31*C31,IF(C31 ="",B31*D31))) -> 1
A32: dryer sheets | B32: 4 | H32: dryer sheets | J32: =IF(C32+D32=0,B32,IF(D32="",B32*C32,IF(C32 ="",B32*D32))) -> 4
A33: dryer lint | B33: 3 | J33: =IF(C33+D33=0,B33,IF(D33="",B33*C33,IF(C33 ="",B33*D33))) -> 3
A34: paper | B34: 1 | G34: Imatiion | H34: disk laber | I34: paper | J34: =IF(C34+D34=0,B34,IF(D34="",B34*C34,IF(C34 ="",B34*D34))) -> 1
A35: food package | B35: 1 | D35: 12 | G35: Dole | H35: frozen Concetrate | I35: Pineapple | J35: =IF(C35+D35=0,B35,IF(D35="",B35*C35,IF(C35 ="",B35*D35))) -> 12
A36: plastic | B36: 1 | H36: produce bag | J36: =IF(C36+D36=0,B36,IF(D36="",B36*C36,IF(C36 ="",B36*D36))) -> 1
A37: plastic | B37: 4 | H37: unidentifiable plastic bags | J37: =IF(C37+D37=0,B37,IF(D37="",B37*C37,IF(C37 ="",B37*D37))) -> 4
A38: fiol | B38: 1 | H38: fiol | I38: w. Meat Juice | J38: =IF(C38+D38=0,B38,IF(D38="",B38*C38,IF(C38 ="",B38*D38))) -> 1
A39: plant | B39: 7 | H39: dasies | J39: =IF(C39+D39=0,B39,IF(D39="",B39*C39,IF(C39 ="",B39*D39))) -> 7
A40: plant | B40: 3 | H40: carnations | J40: =IF(C40+D40=0,B40,IF(D40="",B40*C40,IF(C40 ="",B40*D40))) -> 3
A41: paper | B41: 1 | G41: Imperial Plastics | H41: Label | J41: =IF(C41+D41=0,B41,IF(D41="",B41*C41,IF(C41 ="",B41*D41))) -> 1
A42: fiol | B42: 1 | G42: Hershey | H42: Milk chocolate hershey Kiss | J42: =IF(C42+D42=0,B42,IF(D42="",B42*C42,IF(C42 ="",B42*D42))) -> 1
A43: metal | B43: 1 | G43: Thomas Kemper | H43: Soda | J43: =IF(C43+D43=0,B43,IF(D43="",B43*C43,IF(C43 ="",B43*D43))) -> 1
A44: food | B44: 1 | H44: salt watter Taffy | J44: =IF(C44+D44=0,B44,IF(D44="",B44*C44,IF(C44 ="",B44*D44))) -> 1
A45: paper | B45: 2 | H45: Facial Tissues | J45: =IF(C45+D45=0,B45,IF(D45="",B45*C45,IF(C45 ="",B45*D45))) -> 2
A46: paper | B46: 2 | H46: napkins | J46: =IF(C46+D46=0,B46,IF(D46="",B46*C46,IF(C46 ="",B46*D46))) -> 2
A47: food | B47: 3 | H47: egg shells | J47: =IF(C47+D47=0,B47,IF(D47="",B47*C47,IF(C47 ="",B47*D47))) -> 3
A48: plastic | B48: 1 | H48: tortilla wrapper | J48: =IF(C48+D48=0,B48,IF(D48="",B48*C48,IF(C48 ="",B48*D48))) -> 1
A49: 1 | G49: tortilla wrapper | I49: =IF(B49+C49=0,A49,IF(C49="",A49*B49,IF(B49 ="",A49*C49))) -> 1