A1: Group ID | B1: Total Weight | C1: Collection Date | D1: Analysis Date | E1: Source | F1: Recorder(s) | I1: Garbage Project Survey Data
A2: 2 | B2: 1314 g | C2: 37342 | D2: 37343 | F2: Kim Char | I2: Spring 2002 Survey
A3: A: | B3: B: | C3: C: | D3: D: | E3: E: | F3: F: | G3: G: | H3: H: | I3: I: | J3: J: | K3: Group members
A4: Item Code | B4: Count | C4: Fluid Ounces | D4: Solid Ounces | E4: Cost | F4: Waste gms. | G4: Brand | H4: Type | I4: Material | J4: Totals, BxC or D
A5: 1 | B5: 2 | D5: 7.5 | E5: 00.39 | G5: shop right | I5: vc | J5: =B5*D5 -> 15 | K5: Laurie Stoddard
A6: 2 | B6: 3 | C6: 64 | G6: ruby kiss & juicy juice | J6: =B6*C6 -> 192 | K6: Andrew Cannon | IV6: =SUM(A6:IU6) -> 261
A7: 3 | B7: 1 | G7: albertsons green beans | I7: s | J7: =B7*D7 -> 0 | K7: Doug Cannon
A8: 4 | B8: 1 | D8: 16 | G8: albertsons spinach | I8: d | J8: =B8*D8 -> 16 | K8: Abe Pedroza
A9: 5 | B9: 2 | D9: 10 | G9: frosted mini wheats/ kellogs | I9: v | J9: =B9*D9 -> 20 | K9: Abe Mobley
A10: 6 | B10: 1 | C10: 200 | D10: 19 | G10: linchberg country cocktail | I10: v | J10: =B10*C10 -> 200 | K10: Jeff Farless
A11: 7 | B11: 1 | G11: circular piece of card board | I11: h | J11: =B11*C11 -> 0 | K11: Kim Char
A12: 8 | B12: 5 | G12: aluminium foil | I12: v | J12: =B12*C12 -> 0 | K12: Jessica Tapia
A13: 9 | B13: 3 | D13: 12 | G13: kraft cheese wrapper | I13: c | J13: =B13*D13 -> 36
A14: 10 | B14: 1 | D14: 16 | G14: french bread wrapper | I14: d | J14: =B14*D14 -> 16
A15: 11 | B15: 1 | G15: top to old spice deoderant | I15: a | J15: =B15*C15 -> 0
A16: 12 | B16: 1 | G16: paper bags | I16: s | J16: =B16*C16 -> 0
A17: 13 | B17: 1 | G17: bandaid | I17: s | J17: =B17*C17 -> 0
A18: 14 | B18: 10 | G18: plastic bags | I18: s | J18: =B18*C18 -> 0
A19: 15 | B19: 2 | G19: albertsons reciept | I19: d | J19: =B19*C19 -> 0
A20: 16 | B20: 15 | G20: pieces of paper | I20: a | J20: =B20*C20 -> 0
A21: 17 | B21: 8 | G21: pieces of mail | I21: a | J21: =B21*C21 -> 0
A22: 18 | B22: 1 | D22: 16 | G22: zentist strawberry jelly | I22: a | J22: =B22*D22 -> 16
A23: 19 | B23: 1 | G23: kleenex | I23: a | J23: 0