A1: Group ID | B1: Total Weight | C1: Collection Date | D1: Analysis Date | E1: Source | F1: Recorder(s) | I1: Garbage Project Survey Data | M1: Group Members
A2: Group 2 | C2: 37328 | D2: 37329 | F2: B. Fowler | I2: Spring 2002 Survey | M2: Doug Cannon
A3: A: | B3: B: | C3: C: | D3: D: | E3: E: | F3: F: | G3: G: | H3: H: | I3: I: | J3: J: | M3: Andy Cannon
A4: Item Code | B4: Count | C4: Fluid Ounces | D4: Solid Ounces | E4: Cost | F4: Waste gms. | G4: Brand | H4: Type | I4: Material | J4: Totals, BxC or D | M4: Abe Mobley
A5: 1 | B5: 2 | D5: 31.2 & 9.2 | G5: Smart Ones/Milton | I5: V | J5: =SUM(C5:D5) -> 0 | M5: Abe Pedroza
A6: 2 | B6: 8 | D6: 0.5 | G6: Lipton | I6: X | J6: =SUM(C6:D6) -> 0.5 | M6: Jeff Farless
A7: 3 | B7: 5 | D7: 00.2 | G7: Dixie | I7: A | J7: =SUM(C7:D7) -> 00.2 | M7: Chris Lack
A8: 4 | B8: 5 | D8: 4 | G8: Dannimals | I8: S | J8: =SUM(C8:D8) -> 4 | M8: Laurie Stoddard
A9: 5 | B9: 10 | D9: 00.03 | G9: Ziploc | I9: D | J9: =SUM(C9:D9) -> 00.03
A10: 6 | B10: 1 | D10: 5lbs | G10: Sunny Select | I10: A | J10: =SUM(C10:D10) -> 0
A11: 7 | B11: 1 | D11: 14.5 | G11: S & W | I11: C | J11: =SUM(C11:D11) -> 14.5
A12: 8 | B12: 20 | D12: 00.01 | E12: 1 | G12: Barbie | I12: A | J12: =SUM(C12:D12) -> 00.01
A13: 9 | B13: 5 | D13: 00.02 | G13: Dixie | I13: A | J13: =SUM(C13:D13) -> 00.02
A14: 10 | B14: 1 | D14: 1.34 | G14: Mountain Mikes | I14: X | J14: =SUM(C14:D14) -> 1.34
A15: 11 | B15: 1 | D15: 00.23 | G15: Tylenol | I15: X | J15: =SUM(C15:D15) -> 00.23
A16: 12 | B16: 1 | D16: 2.1356000000000002 | G16: Play-Do | I16: X | J16: =SUM(C16:D16) -> 2.1356000000000002
A17: 13 | J17: =SUM(C17:D17) -> 0
A18: 14 | J18: =SUM(C18:D18) -> 0
A19: 15 | J19: =SUM(C19:D19) -> 0
A20: 16 | J20: =SUM(C20:D20) -> 0
A21: 17 | J21: =SUM(C21:D21) -> 0
A22: 18 | J22: =SUM(C22:D22) -> 0
A23: 19 | J23: =SUM(C23:D23) -> 0
A24: 20 | J24: =SUM(C24:D24) -> 0
A25: 21 | J25: =SUM(C25:D25) -> 0
A26: 22 | J26: =SUM(C26:D26) -> 0
A27: 23 | J27: =SUM(C27:D27) -> 0
A28: 24 | J28: =SUM(C28:D28) -> 0
A29: 25 | J29: =SUM(C29:D29) -> 0
A30: 26 | J30: =SUM(C30:D30) -> 0
A31: 27 | J31: =SUM(C31:D31) -> 0
A32: 28 | J32: =SUM(C32:D32) -> 0
A33: 29 | J33: =SUM(C33:D33) -> 0
A34: 30 | J34: =SUM(C34:D34) -> 0
A35: 31 | J35: =SUM(C35:D35) -> 0
A36: 32 | J36: =SUM(C36:D36) -> 0
A37: 33 | J37: =SUM(C37:D37) -> 0
A38: 34 | J38: =SUM(C38:D38) -> 0
A39: 35 | J39: =SUM(C39:D39) -> 0
A40: 36 | J40: =SUM(C40:D40) -> 0
A41: 37 | J41: =SUM(C41:D41) -> 0
A42: 38 | J42: =SUM(C42:D42) -> 0
A43: 39 | J43: =SUM(C43:D43) -> 0
A44: 40 | J44: =SUM(C44:D44) -> 0