A1: Group ID | B1: Total Weight | C1: Collection Date | D1: Analysis Date | E1: Source | F1: Recorder(s) | I1: Garbage Project Survey Data | M1: Group Members
A2: Group 3 | C2: 37328 | D2: 37329 | F2: B. Fowler | I2: Spring 2002 Survey | M2: Annie Whirli
A3: A: | B3: B: | C3: C: | D3: D: | E3: E: | F3: F: | G3: G: | H3: H: | I3: I: | J3: J: | M3: Erin Wynns
A4: Item Code | B4: Count | C4: Fluid Ounces | D4: Solid Ounces | E4: Cost | F4: Waste gms. | G4: Brand | H4: Type | I4: Material | J4: Totals, BxC or D | M4: Amy Gotshalk-Stein
A5: 1 | B5: 14 | G5: spinach | I5: f | J5: =SUM(C5:D5) -> 0 | M5: Rachel Jost
A6: 2 | B6: 3 | G6: tomato | I6: f | J6: =SUM(C6:D6) -> 0 | M6: Missy Dellens
A7: 3 | B7: 0.5 | G7: avacado | I7: f | J7: =SUM(C7:D7) -> 0 | M7: Chris Eichermueller
A8: 4 | B8: 1 | C8: 14.5 | G8: S & W | I8: f | J8: =SUM(C8:D8) -> 14.5
A9: 5 | B9: 3 | I9: c | J9: =SUM(C9:D9) -> 0
A10: 6 | B10: 4 | I10: f | J10: =SUM(C10:D10) -> 0
A11: 7 | B11: 1 | G11: Klondike | I11: f | J11: =SUM(C11:D11) -> 0
A12: 8 | B12: 00.33 | I12: f | J12: =SUM(C12:D12) -> 0
A13: 9 | B13: 0.5 | I13: f | J13: =SUM(C13:D13) -> 0
A14: 10 | B14: 1 | D14: 1/4lbs | I14: f | J14: =SUM(C14:D14) -> 0
A15: 11 | B15: 1 | D15: 9.2 | G15: Smart One | I15: a | J15: =SUM(C15:D15) -> 9.2
A16: 12 | B16: 1.5 | I16: f | J16: =SUM(C16:D16) -> 0
A17: 13 | B17: 2 | D17: 2lbs | G17: Miltons | I17: a | J17: =SUM(C17:D17) -> 0
A18: 14 | B18: 2 | I18: a | J18: =SUM(C18:D18) -> 0
A19: 15 | B19: 5 | I19: a | J19: =SUM(C19:D19) -> 0
A20: 16 | B20: 1 | D20: 3 | G20: Hostess | I20: d | J20: =SUM(C20:D20) -> 3
A21: 17 | B21: 1 | D21: 1.3 | G21: Quaker | I21: d | J21: =SUM(C21:D21) -> 1.3
A22: 18 | B22: 1 | D22: 1.7 | G22: Whatsomacallit | I22: d | J22: =SUM(C22:D22) -> 1.7
A23: 19 | B23: 4 | I23: a | J23: =SUM(C23:D23) -> 0
A24: 20 | B24: 5 | I24: a | J24: =SUM(C24:D24) -> 0
A25: 21 | B25: 1slice | G25: Pepperoni | I25: f | J25: =SUM(C25:D25) -> 0
A26: 22 | B26: 3 | D26: 9 | G26: Dannon | I26: d | J26: =SUM(C26:D26) -> 9
A27: 23 | B27: 9 | G27: Lipton | I27: f | J27: =SUM(C27:D27) -> 0
A28: 24 | B28: 4 | I28: a | J28: =SUM(C28:D28) -> 0
A29: 25 | B29: 1 | I29: a | J29: =SUM(C29:D29) -> 0
A30: 26 | B30: 1 | D30: 2 | G30: Tylenol | I30: d | J30: =SUM(C30:D30) -> 2
A31: 27 | B31: 1 | G31: Cent. Coast H&H | I31: a | J31: =SUM(C31:D31) -> 0
A32: 28 | G32: Christian Camp | I32: a | J32: =SUM(C32:D32) -> 0
A33: 29 | G33: Pac Bell | I33: a | J33: =SUM(C33:D33) -> 0
A34: 30 | B34: 1 | D34: 5 | G34: Sunny Select | I34: a | J34: =SUM(C34:D34) -> 5
A35: 31 | B35: 6 | G35: Misc. | I35: a | J35: =SUM(C35:D35) -> 0
A36: 32 | B36: 5 | G36: Pepperidge Farm | I36: f | J36: =SUM(C36:D36) -> 0
A37: 33 | B37: 5 | G37: Ziplock | I37: d | J37: =SUM(C37:D37) -> 0
A38: 34 | B38: 1 | G38: Lemon Juice | I38: d | J38: =SUM(C38:D38) -> 0
A39: 35 | B39: 16pcs | G39: Muffin Wrappers | I39: a | J39: =SUM(C39:D39) -> 0
A40: 36 | B40: 5 | G40: Miso | I40: b | J40: =SUM(C40:D40) -> 0
A41: 37 | B41: 6 | I41: a | J41: =SUM(C41:D41) -> 0
A42: 38 | B42: 11 | I42: a | J42: =SUM(C42:D42) -> 0
A43: 39 | B43: 16 | G43: Golden Book | I43: a | J43: =SUM(C43:D43) -> 0
A44: 40 | B44: 1 | G44: Play Dough | I44: x | J44: =SUM(C44:D44) -> 0